{
  "schema_version": "1.0",
  "tool_name": "CB-Dock3",
  "branch": "tool/cb-dock",
  "team_members": [
    "Samruddhi",
    "Marwan"
  ],
  "software_version": "CB-Dock3 web server; structure-based engine: AutoDock Vina 1.2.0",
  "date_completed": "2026-08-20",
  "input_commit_hash": "6564a76",
  "score_direction": "lower_is_better",
  "receptor_prep_method": "OpenMM-written PahP/PahS PDB files uploaded to CB-Dock3; original model provenance and exact preparation command are not yet recorded.",
  "ligand_prep_method": "Individual ligand records extracted from the canonical ligands.sdf and uploaded directly to CB-Dock3.",
  "docking_parameters": {
    "mode": "structure-based blind docking",
    "box": {
      "mode": "blind",
      "center_xyz": null,
      "size_xyz": null
    },
    "pocket_detection": "CurPocket",
    "number_of_cavities": 5,
    "scoring_function": "AutoDock Vina 1.2.0",
    "exhaustiveness": null,
    "num_poses": 1,
    "random_seed": null,
    "selection_rule": "lowest docking score across the five structure-based cavities",
    "template_results_used": false
  },
  "hardware": "CB-Dock3 remote web server (hardware not reported)",
  "runtime_total_sec": null,
  "results": [
    {
      "target_id": "PahP",
      "ligand_id": "benzo_a_pyrene",
      "pubchem_cid": "2336",
      "docking_score": -9.6,
      "score_unit": "kcal/mol",
      "rank_within_tool": 1,
      "pose_file": "tools/cb-dock/results/poses/PahP__benzo_a_pyrene__cb-dock__v1.pdb",
      "runtime_sec": null,
      "status": "ok",
      "failure_reason": null,
      "notes": "Best structure-based CB-Dock cavity: C4"
    },
    {
      "target_id": "PahP",
      "ligand_id": "fluoranthene",
      "pubchem_cid": "9154",
      "docking_score": -8.1,
      "score_unit": "kcal/mol",
      "rank_within_tool": 2,
      "pose_file": "tools/cb-dock/results/poses/PahP__fluoranthene__cb-dock__v1.pdb",
      "runtime_sec": null,
      "status": "ok",
      "failure_reason": null,
      "notes": "Best structure-based CB-Dock cavity: C4"
    },
    {
      "target_id": "PahP",
      "ligand_id": "pyrene",
      "pubchem_cid": "31423",
      "docking_score": -8.0,
      "score_unit": "kcal/mol",
      "rank_within_tool": 3,
      "pose_file": "tools/cb-dock/results/poses/PahP__pyrene__cb-dock__v1.pdb",
      "runtime_sec": null,
      "status": "ok",
      "failure_reason": null,
      "notes": "Best structure-based CB-Dock cavity: C4"
    },
    {
      "target_id": "PahP",
      "ligand_id": "phenanthrene",
      "pubchem_cid": "995",
      "docking_score": -7.5,
      "score_unit": "kcal/mol",
      "rank_within_tool": 4,
      "pose_file": "tools/cb-dock/results/poses/PahP__phenanthrene__cb-dock__v1.pdb",
      "runtime_sec": null,
      "status": "ok",
      "failure_reason": null,
      "notes": "Best structure-based CB-Dock cavity: C4"
    },
    {
      "target_id": "PahP",
      "ligand_id": "anthracene",
      "pubchem_cid": "8418",
      "docking_score": -7.3,
      "score_unit": "kcal/mol",
      "rank_within_tool": 5,
      "pose_file": "tools/cb-dock/results/poses/PahP__anthracene__cb-dock__v1.pdb",
      "runtime_sec": null,
      "status": "ok",
      "failure_reason": null,
      "notes": "Best structure-based CB-Dock cavity: C4"
    },
    {
      "target_id": "PahP",
      "ligand_id": "naphthalene",
      "pubchem_cid": "931",
      "docking_score": -6.0,
      "score_unit": "kcal/mol",
      "rank_within_tool": 6,
      "pose_file": "tools/cb-dock/results/poses/PahP__naphthalene__cb-dock__v1.pdb",
      "runtime_sec": null,
      "status": "ok",
      "failure_reason": null,
      "notes": "Best structure-based CB-Dock cavity: C4"
    },
    {
      "target_id": "PahP",
      "ligand_id": "glucose_NEGCTRL",
      "pubchem_cid": "5793",
      "docking_score": -5.5,
      "score_unit": "kcal/mol",
      "rank_within_tool": 7,
      "pose_file": "tools/cb-dock/results/poses/PahP__glucose_NEGCTRL__cb-dock__v1.pdb",
      "runtime_sec": null,
      "status": "ok",
      "failure_reason": null,
      "notes": "Best structure-based CB-Dock cavity: C4"
    },
    {
      "target_id": "PahS",
      "ligand_id": "benzo_a_pyrene",
      "pubchem_cid": "2336",
      "docking_score": -9.2,
      "score_unit": "kcal/mol",
      "rank_within_tool": 1,
      "pose_file": "tools/cb-dock/results/poses/PahS__benzo_a_pyrene__cb-dock__v1.pdb",
      "runtime_sec": null,
      "status": "ok",
      "failure_reason": null,
      "notes": "Best structure-based CB-Dock cavity: C2"
    },
    {
      "target_id": "PahS",
      "ligand_id": "fluoranthene",
      "pubchem_cid": "9154",
      "docking_score": -8.5,
      "score_unit": "kcal/mol",
      "rank_within_tool": 2,
      "pose_file": "tools/cb-dock/results/poses/PahS__fluoranthene__cb-dock__v1.pdb",
      "runtime_sec": null,
      "status": "ok",
      "failure_reason": null,
      "notes": "Best structure-based CB-Dock cavity: C3"
    },
    {
      "target_id": "PahS",
      "ligand_id": "anthracene",
      "pubchem_cid": "8418",
      "docking_score": -7.9,
      "score_unit": "kcal/mol",
      "rank_within_tool": 3,
      "pose_file": "tools/cb-dock/results/poses/PahS__anthracene__cb-dock__v1.pdb",
      "runtime_sec": null,
      "status": "ok",
      "failure_reason": null,
      "notes": "Best structure-based CB-Dock cavity: C3"
    },
    {
      "target_id": "PahS",
      "ligand_id": "pyrene",
      "pubchem_cid": "31423",
      "docking_score": -7.9,
      "score_unit": "kcal/mol",
      "rank_within_tool": 3,
      "pose_file": "tools/cb-dock/results/poses/PahS__pyrene__cb-dock__v1.pdb",
      "runtime_sec": null,
      "status": "ok",
      "failure_reason": null,
      "notes": "Best structure-based CB-Dock cavity: C2"
    },
    {
      "target_id": "PahS",
      "ligand_id": "phenanthrene",
      "pubchem_cid": "995",
      "docking_score": -7.5,
      "score_unit": "kcal/mol",
      "rank_within_tool": 5,
      "pose_file": "tools/cb-dock/results/poses/PahS__phenanthrene__cb-dock__v1.pdb",
      "runtime_sec": null,
      "status": "ok",
      "failure_reason": null,
      "notes": "Best structure-based CB-Dock cavity: C2"
    },
    {
      "target_id": "PahS",
      "ligand_id": "naphthalene",
      "pubchem_cid": "931",
      "docking_score": -6.1,
      "score_unit": "kcal/mol",
      "rank_within_tool": 6,
      "pose_file": "tools/cb-dock/results/poses/PahS__naphthalene__cb-dock__v1.pdb",
      "runtime_sec": null,
      "status": "ok",
      "failure_reason": null,
      "notes": "Best structure-based CB-Dock cavity: C3"
    },
    {
      "target_id": "PahS",
      "ligand_id": "glucose_NEGCTRL",
      "pubchem_cid": "5793",
      "docking_score": -6.0,
      "score_unit": "kcal/mol",
      "rank_within_tool": 7,
      "pose_file": "tools/cb-dock/results/poses/PahS__glucose_NEGCTRL__cb-dock__v1.pdb",
      "runtime_sec": null,
      "status": "ok",
      "failure_reason": null,
      "notes": "Best structure-based CB-Dock cavity: C2"
    }
  ],
  "failed_cases": [],
  "warnings": [
    "Receptor model provenance and exact preparation command must be confirmed before final submission."
  ],
  "notes": "Primary results use CB-Dock3 structure-based blind docking. For each target-ligand pair, the CurPocket cavity with the lowest AutoDock Vina score was selected. Template-based docking results, where available, were not used for ranking."
}
