{
  "schema_version": "1.0",
  "tool_name": "AutoDock Vina",
  "branch": "tool/autodock-vina",
  "team_members": [
    "Divyashree",
    "Ana"
  ],
  "software_version": "1.2.7",
  "date_completed": "2026-10-03",
  "input_commit_hash": "6564a76",
  "score_direction": "lower_is_better",
  "receptor_prep_method": "canonical PahP structure.pdb; PDBQT via Open Babel 3.1.0",
  "ligand_prep_method": "canonical ligands.sdf conformers as-is; PDBQT via Open Babel 3.1.0",
  "docking_parameters": {
    "exhaustiveness": 16,
    "num_modes": 9,
    "seed": 42,
    "box_center": [
      70.83,
      71.96,
      59.18
    ],
    "box_size": [
      21.3,
      19.6,
      27.3
    ],
    "box_source": "fpocket pocket 4; hydrophobicity/aromaticity ranking; blind-docking cross-validated"
  },
  "hardware": "Apple Silicon (osx-arm64)",
  "runtime_total_sec": null,
  "results": [
    {
      "target_id": "PahP",
      "ligand_id": "benzo_a_pyrene",
      "pubchem_cid": "2336",
      "docking_score": -9.52,
      "score_unit": "kcal/mol",
      "rank_within_tool": 1,
      "pose_file": "tools/autodock-vina/results/poses/PahP__benzo_a_pyrene__autodock-vina__v1.pdbqt",
      "runtime_sec": null,
      "status": "ok",
      "failure_reason": null,
      "notes": ""
    },
    {
      "target_id": "PahP",
      "ligand_id": "fluoranthene",
      "pubchem_cid": "9154",
      "docking_score": -8.095,
      "score_unit": "kcal/mol",
      "rank_within_tool": 2,
      "pose_file": "tools/autodock-vina/results/poses/PahP__fluoranthene__autodock-vina__v1.pdbqt",
      "runtime_sec": null,
      "status": "ok",
      "failure_reason": null,
      "notes": ""
    },
    {
      "target_id": "PahP",
      "ligand_id": "pyrene",
      "pubchem_cid": "31423",
      "docking_score": -8.021,
      "score_unit": "kcal/mol",
      "rank_within_tool": 3,
      "pose_file": "tools/autodock-vina/results/poses/PahP__pyrene__autodock-vina__v1.pdbqt",
      "runtime_sec": null,
      "status": "ok",
      "failure_reason": null,
      "notes": "MD + MM-GBSA also performed; ligand dissociates from the docked site within 25 ns"
    },
    {
      "target_id": "PahP",
      "ligand_id": "phenanthrene",
      "pubchem_cid": "995",
      "docking_score": -7.448,
      "score_unit": "kcal/mol",
      "rank_within_tool": 4,
      "pose_file": "tools/autodock-vina/results/poses/PahP__phenanthrene__autodock-vina__v1.pdbqt",
      "runtime_sec": null,
      "status": "ok",
      "failure_reason": null,
      "notes": "MD + MM-GBSA also performed; ligand dissociates from the docked site within 25 ns"
    },
    {
      "target_id": "PahP",
      "ligand_id": "anthracene",
      "pubchem_cid": "8418",
      "docking_score": -7.363,
      "score_unit": "kcal/mol",
      "rank_within_tool": 5,
      "pose_file": "tools/autodock-vina/results/poses/PahP__anthracene__autodock-vina__v1.pdbqt",
      "runtime_sec": null,
      "status": "ok",
      "failure_reason": null,
      "notes": ""
    },
    {
      "target_id": "PahP",
      "ligand_id": "naphthalene",
      "pubchem_cid": "931",
      "docking_score": -6.053,
      "score_unit": "kcal/mol",
      "rank_within_tool": 6,
      "pose_file": "tools/autodock-vina/results/poses/PahP__naphthalene__autodock-vina__v1.pdbqt",
      "runtime_sec": null,
      "status": "ok",
      "failure_reason": null,
      "notes": ""
    },
    {
      "target_id": "PahP",
      "ligand_id": "glucose_NEGCTRL",
      "pubchem_cid": "5793",
      "docking_score": -5.383,
      "score_unit": "kcal/mol",
      "rank_within_tool": 7,
      "pose_file": "tools/autodock-vina/results/poses/PahP__glucose_NEGCTRL__autodock-vina__v1.pdbqt",
      "runtime_sec": null,
      "status": "ok",
      "failure_reason": null,
      "notes": "negative control"
    }
  ],
  "failed_cases": [],
  "warnings": [
    "MD and MM-GBSA performed for pyrene and phenanthrene only.",
    "MD shows both ligands leave the docked pocket; MM-GBSA dG describes post-migration sites, derived Kd withdrawn."
  ],
  "notes": "Binding site proposed as canonical binding_site.yaml value; not yet formally adopted."
}